role_code,display_name,domain,jurisdiction,status,verified_legal,kyb_level,trust_ceiling,tests_count,updated_days_ago,dominant_factor,is_balanced,score,tier,contact_website,contact_email,contact_telegram,factor_QEF,factor_PCF,factor_SCIF,factor_TRF,factor_FRF,factor_CCF,factor_CVF,factor_CVF_B,factor_RF,provisional_reason,_source_url,_data_completeness,_confidence,_notes
FILL_FINISH,Adragos Pharma GmbH,adragos-pharma.com,DE,ACTIVE,true,L3,95,8,83,,,,,https://adragos-pharma.com/sterile-injectable-cdmo-fill-finish-europe/,,,82,80,78,72,78,80,58,,85,,https://adragos-pharma.com/de/impressum/,85,high,ЮЛ ВЕРИФИЦИРОВАНО: Adragos Pharma GmbH; Amtsgericht München HRB 274699 (подтверждено на Impressum сайта adragos-pharma.com/de/impressum/ + northdata.com + creditreform.de). Адрес: Sonnenstrasse 17; 80331 München DE. VAT: DE345670346. GDs: Dr. Andreas Raabe; Philipp Ziehr. Гр. регистрации: 29.03.2022. PE-собственник: FSN Capital VI (через Adragos Pharma Group TopCo GmbH; HRB 298787; осн. 09.01.2025). FILL_FINISH площадки: (1) Jura CH (Courroux; Baccinex; приобретено 25.11.2024): EU-GMP + FDA + Swissmedic; жидкие + lyo виалы; ~200 клинических партий/год; без мин. размера партии; ~120 FTE. (2) Maisons-Alfort FR: EU-GMP; 12 международных органов. (3) Livron FR: EU-GMP; >160 млн ампул/год (новая линия 07.11.2024). Также: Halden NO (sterile liquids + BFS; март 2024); Leipzig DE (non-sterile liquid filling; март 2025); Kawagoe JP (solid dosage). kyb_level повышен L2→L3: HRB 274699 публично верифицирован + EU-GMP+FDA сертификаты на Jura CH площадке (источники: adragos-pharma.com/jura-switzerland; pharmtech.com April 2026). uda=83: PharmTech 03.04.2026 подтверждает текущий статус операций. CVF_B пуст: Named client не найден в публичных источниках. Источники: adragos-pharma.com/de/impressum/ (HRB); adragos-pharma.com/adragos-pharma-acquires-baccinex (GMP+lyo); pharmtech.com/view/adragos-pharma-completes-liquid-filling-line-installation-germany (04.2026).
FILL_FINISH,FAMAR S.A.,famar-group.com,GR,PROVISIONAL,false,L1,75,5,294,,,,,https://www.famar-group.com,,,80,75,68,72,72,68,,,68,Юрлицо: греческая компания FAMAR S.A. Регистрационный номер GEMI (Generaliko Emporiko Mitroo) не найден в публичном доступе при данном исследовании. Domain исправлен famar.com → famar-group.com. jurisdiction исправлен FR → GR (Famar — греческая компания; HQ Afina/Aainy). Homburg DE площадка управляется Famar Healthcare Germany GmbH (новое DE юрлицо; Handelsregister не верифицирован). GMP статус Homburg (BfArM/EudraGMDP) после перехода от MiP Pharma (закрытие 04.09.2025) требует верификации. ШАГ: поиск в GEMI (gemi.gov.gr) + Handelsregister для Famar Healthcare Germany GmbH.,https://www.famar-group.com/new/famar-group-announces-acquisition-of-sterile-manufacturing-site-in-homburg-germany/,60,medium,Юрисдикция исправлена: FR→GR (Famar — греческая CDMO; основана 1949; HQ Afiny GR). PE-собственник: MidEuropa (большинство с июля 2024; from ECM Partners + Metric Capital). 7 EU площадок: Греция (4); Испания; Италия; и новая Homburg DE. FILL_FINISH Homburg: подписание 13.05.2025; закрытие 04.09.2025 (EINPresswire.com). Оператор: Famar Healthcare Germany GmbH (новое DE юрлицо). Возможности Homburg: sterile liquid + lyophilized fill & finish (подтверждено на famar-group.com + prnewswire + fiercepharma 2025). Site выпускал антибиотики MiP Pharma (clindamycin; vancomycin) в sterile injectables форме с 2012. uda=294: от 04.09.2025 (closing PR). CVF_B пуст — named client для Homburg не найден. ВАЖНО: domain был famar.com (НЕВЕРНО); исправлен на famar-group.com. QEF=80 (sterile fill-finish + lyo confirmed; site имеет историю с 2012; но GMP под Famar Healthcare Germany не верифицирован). RF=68 (переходный период; GEMI не найден; новое DE юрлицо).
FILL_FINISH,Recipharm Cramlington Ltd,recipharm.com,GB,PROVISIONAL,false,L0,65,0,1627,,,,,https://www.recipharm.com,,,15,15,20,72,10,10,,,15,КРИТИЧЕСКАЯ ОШИБКА ЗАПИСИ (требует удаления или замены): Площадка Cramlington (Aesica Pharmaceuticals Ltd) была продана Pharmaron 10.01.2022 (источник: pharmaron.com press release). После продажи площадка является частью Pharmaron UK; НЕ Recipharm. Дополнительно: Cramlington был API-химическим производством (cGMP API; >100 куб.м реакторов); НЕ sterile fill-finish + lyophilization объектом. Recipharm Limited Companies House GB 08174784 существует как UK holding entity; но fill-finish + lyo мощностей в UK у Recipharm не задокументировано. ДЕЙСТВИЕ: заменить данную запись на Recipharm Wasserburg GmbH (DE; модульная стерильная линия VarioSys; GMP operational 02.2025) или Recipharm Kaysersberg SAS (FR) — реальные fill-finish площадки Recipharm в EU.,https://www.pharmaron.com/about-us/latest-news/pharmaron-acquires-commercial-api-manufacturing-facility-in-the-united-kingdom-from-recipharm/,10,low,СТАТУС: ЗАПИСЬ СОДЕРЖИТ КРИТИЧЕСКУЮ ОШИБКУ. Factual errors: (1) Cramlington sold to Pharmaron 10.01.2022 — не является площадкой Recipharm. (2) Cramlington = API chemistry (>100 cuM reactor capacity); НЕ sterile aseptic fill-finish + lyophilization. Recipharm Limited CH GB 08174784 (Companies House) = UK holding entity (верифицировано через URL поиска: find-and-update.company-information.service.gov.uk/company/08174784); но не fill-finish. uda=1627: последняя верифицируемая дата — 10.01.2022 (продажа). TRF=72 сохранён: отражает общую репутацию бренда Recipharm как CDMO; не данной площадки. Корректные EU fill-finish площадки Recipharm: Wasserburg DE (VarioSys GMP; 02.2025); Kaysersberg FR; Cuxhaven DE (ReciBioPharm). CVF_B пусто. Рекомендация руководству реестра: УДАЛИТЬ или ЗАМЕНИТЬ данную строку.
FILL_FINISH,PCI Pharma Services (UK) Ltd,pciservices.com,GB,PROVISIONAL,false,L0,65,1,387,,,,,https://pciservices.com,,,45,42,38,62,38,35,,,55,UK sterile fill-finish + lyophilization мощности НЕ верифицированы для UK площадок. Holmes Chapel (Cheshire UK) и Edinburgh UK сайты ориентированы на solid dosage и клиническую упаковку; НЕ aseptic fill-finish + lyo. Основные sterile fill-finish мощности PCI: Bedford NH USA (twin lyo; GMP Q1 2025); Pennsylvania USA (legacy). Companies House UK юрлицо PCI Pharma Services (UK) Ltd — регистрационный номер не найден при исследовании. MHRA Establishment License для UK sterile не верифицирован. EU sterile: Millmount Healthcare (Enniscorthy; Ирландия IE) приобретён PCI — возможны IE fill-finish мощности (требует отдельной верификации по EudraGMDP Ireland). ШАГ: Companies House поиск по 'PCI Pharma Services'; EudraGMDP поиск Ireland/UK; верификация Holmes Chapel MHRA license.,https://pci.com/sterile-services/sterile-drug-manufacturing/sterile-fill-finish,38,low,PCI Pharma Services HQ: Philadelphia PA USA. UK сайты: Holmes Chapel Cheshire (solid dosage; clinical packaging; MHRA licensed но для clinical packs/solids); Edinburgh UK. Sterile fill-finish + lyo PCI = US-based (Bedford NH: twin 430 sqft lyophilizers; GMP от Q1 2025; вал. 300K vials/batch; source: pci.com/news/sterile-fill-finish-lyophilization-line-bedford-expansion-begins). EU $365M investment announcement (03.06.2025; BIO 2025) упоминает EU facilities — детали EU sterile не раскрыты в доступных источниках. EU sterile кандидат: Penn Pharma (Tredegar; Wales UK) — приобретён PCI 2014; выпускает sterile injectables (MHRA licensed); ПРОВЕРИТЬ EudraGMDP для fill-finish + lyo. TRF=62: PCI реальный CDMO с 25+ годами sterile опыта; но EU/UK capability данной записи не верифицирована. uda=387: June 2025 EU investment PR. CVF_B пусто — EU/UK fill-finish named client не найден.
FILL_FINISH,Catalent Germany Eberbach GmbH,catalent.com,DE,PROVISIONAL,true,L2,88,0,567,,,,,https://www.catalent.com/our-locations/europe/eberbach-germany/,,,12,12,15,82,10,10,,,20,КРИТИЧЕСКАЯ ОШИБКА КАТЕГОРИИ (требует удаления из FILL_FINISH слоя): Площадка Eberbach DE является SOFTGEL-производством (до 2.8 млрд мягких капсул/год; R.P. Scherer heritage; подтверждено на catalent.com/our-locations/europe/eberbach-germany/). Заявленные sterile fill-finish + lyophilization мощности НЕ существуют на данном сайте. Catalent's fill-finish площадки (Anagni IT; Bloomington IN; Brussels BE) проданы Novo Nordisk за $11 млрд (закрытие декабрь 2024) и выведены из CDMO-доступности (кэптивные для Novo Nordisk). FDA FEI 3002808098 подтверждает существование юрлица Catalent Germany Eberbach GmbH; но для softgel/oral dosage. verified_legal=true: юрлицо реально; Handelsregister Mannheim (HRB требует верификации). ДЕЙСТВИЕ: УДАЛИТЬ данную запись из FILL_FINISH слоя; при необходимости перенести в MANUFACTURER-softgel.,https://www.catalent.com/our-locations/europe/eberbach-germany/,12,low,ФАКТИЧЕСКАЯ ОШИБКА В ЗАПИСИ: Eberbach DE = softgel capsule manufacturing (2.8B units/year; oral dosage). Истоки: RP Scherer joint venture c Gelita (60 лет); полное приобретение Catalent 2012. FDA FEI: 3002808098 (fda.report/Company/Catalent-Germany-Eberbach-G-M-B-H). НЕ sterile injectable fill-finish; НЕ lyophilization. Catalent три fill-finish сайта (Anagni IT + Bloomington IN + Brussels BE): проданы Novo Nordisk для GLP-1 производства ($11B; Dec 2024); недоступны как independent CDMO. Catalent Inc. приобретена Novo Holdings за $16.5B (декабрь 2024). uda=567: от December 2024 (acquisition closing). TRF=82: Catalent как глобальный CDMO имеет реальную историю и репутацию; но не для fill-finish на данном сайте. Все fill-finish факторы (QEF/PCF/SCIF/FRF/CCF) выставлены ~10-15 поскольку fill-finish capability в данной локации ОТСУТСТВУЕТ. Для FILL_FINISH реестра: Catalent не имеет доступных EU fill-finish CDMO-площадок после продажи Novo Nordisk. Источник-подтверждение ошибки: catalent.com + DCAT Value Chain Insights Sept 2025 (продажа 3 fill-finish сайтов).
